{
  "$schema": "https://json-schema.org/draft/2020-12/schema",
  "$id": "https://civitas-cerebrum.github.io/element-interactions/schemas/onboarding-status.schema.json",
  "title": "Onboarding pipeline status ledger",
  "description": "Single source of truth for the onboarding pipeline's state. Owned by the onboarding orchestrator (interactive) or the achilles CLI driver (automated). Read by the workflow-reviewer-* subagents and by the onboarding-ledger-* hooks. Lives at tests/e2e/docs/onboarding-status.json in consumer projects (gitignored — same pattern as .phase4-cycle-state.json + coverage-expansion-state.json).",
  "type": "object",
  "additionalProperties": true,
  "required": [
    "schemaVersion",
    "pipelineVersion",
    "runMode",
    "startedAt",
    "currentPhase",
    "status",
    "phases"
  ],
  "properties": {
    "schemaVersion": {
      "type": "integer",
      "const": 1,
      "description": "Schema version for forward-compat. Bump when the shape changes."
    },
    "pipelineVersion": {
      "type": "string",
      "description": "The element-interactions package version that produced this ledger, e.g. '0.4.0'. Used by the workflow-reviewer to check it is reading a ledger shape it understands."
    },
    "runMode": {
      "type": "string",
      "enum": ["standard", "depth"],
      "description": "Mirrors the value captured at the onboarding front-load gate. Propagates to Phase 4 cycleStrictness and Phase 5 coverage-expansion runMode."
    },
    "startedAt": {
      "type": "string",
      "format": "date-time",
      "description": "ISO-8601 timestamp of the front-load gate completion (Step 0 mode selection done, preconditions confirmed)."
    },
    "currentPhase": {
      "type": "integer",
      "minimum": 1,
      "maximum": 8,
      "description": "1=Scaffold, 2=Groundwork, 3=Happy-path, 4=Journey-mapping, 5=Coverage-expansion, 6=Bug-discovery, 7=Secrets-sweep, 8=Report."
    },
    "currentSubStage": {
      "type": ["string", "null"],
      "description": "For phases 4 (cycles) + 5 (passes) only. Values: 'pass-1'..'pass-5', 'cycle-1'..'cycle-5'. Null otherwise.",
      "pattern": "^(pass-[1-5]|cycle-[1-5])$"
    },
    "status": {
      "type": "string",
      "enum": ["in-progress", "blocked", "complete", "aborted"],
      "description": "Pipeline-level status."
    },
    "phases": {
      "type": "array",
      "minItems": 8,
      "maxItems": 8,
      "description": "Length-8 array, populated as the run progresses. Phases 1-8 in order.",
      "items": {
        "type": "object",
        "additionalProperties": true,
        "required": ["id", "name", "status"],
        "properties": {
          "id": {
            "type": "integer",
            "minimum": 1,
            "maximum": 8
          },
          "name": {
            "type": "string",
            "enum": [
              "Scaffold",
              "Groundwork",
              "Happy-path",
              "Journey-mapping",
              "Coverage-expansion",
              "Bug-discovery",
              "Secrets-sweep",
              "Report"
            ]
          },
          "startedAt": {
            "type": ["string", "null"],
            "format": "date-time"
          },
          "finishedAt": {
            "type": ["string", "null"],
            "format": "date-time"
          },
          "status": {
            "type": "string",
            "enum": ["pending", "in-progress", "completed", "blocked", "skipped"]
          },
          "handoverEnvelope": {
            "type": ["object", "null"],
            "additionalProperties": true,
            "description": "The closing subagent's handover envelope for this phase. See schemas/subagent-returns/handover.schema.json. Required (non-null) when reviewerVerdict != 'pending'."
          },
          "reviewerVerdict": {
            "type": ["string", "null"],
            "enum": ["pending", "approved", "rejected", "escalated-to-user", null]
          },
          "reviewerCycles": {
            "type": "integer",
            "minimum": 0,
            "maximum": 3,
            "description": "Number of workflow-reviewer-* dispatches for this phase. Cap is 3; the 3rd rejection escalates."
          },
          "reviewerFindings": {
            "type": "array",
            "items": {
              "type": "object",
              "additionalProperties": true,
              "properties": {
                "checklist-item": { "type": "string" },
                "what-missing": { "type": "string" },
                "methodology-ref": { "type": "string" },
                "fix-instruction": { "type": "string" }
              }
            }
          },
          "deliverables": {
            "type": "array",
            "items": { "type": "string" },
            "description": "Relative paths of files committed during this phase."
          },
          "subStages": {
            "type": "array",
            "description": "Optional. Used by phases 4 (cycles) + 5 (passes).",
            "items": {
              "type": "object",
              "additionalProperties": true,
              "required": ["id", "status"],
              "properties": {
                "id": {
                  "type": "string",
                  "pattern": "^(pass-[1-5]|cycle-[1-5])$"
                },
                "status": {
                  "type": "string",
                  "enum": ["pending", "in-progress", "completed", "blocked", "skipped"]
                },
                "handoverEnvelope": {
                  "type": ["object", "null"],
                  "additionalProperties": true
                },
                "reviewerVerdict": {
                  "type": ["string", "null"],
                  "enum": ["pending", "approved", "rejected", "escalated-to-user", null]
                },
                "reviewerCycles": {
                  "type": "integer",
                  "minimum": 0,
                  "maximum": 3
                },
                "reviewerFindings": {
                  "type": "array",
                  "items": {
                    "type": "object",
                    "additionalProperties": true
                  }
                }
              }
            }
          }
        }
      }
    },
    "approvedDeviations": {
      "type": "array",
      "description": "Structured exceptions: skip-phase / early-stop authorisations captured during the run.",
      "items": {
        "type": "object",
        "additionalProperties": true,
        "required": ["phase", "deviation", "authorizer"],
        "properties": {
          "phase": {
            "type": "integer",
            "minimum": 1,
            "maximum": 8
          },
          "deviation": {
            "type": "string",
            "description": "Short description, e.g. 'skipped' or 'early-stop-at-pass-3'."
          },
          "authorizer": {
            "type": "string",
            "minLength": 1,
            "description": "Verbatim user quote OR a structured reviewer attestation (e.g. 'reviewer-attestation: phase6-redundant-with-phase5')."
          }
        }
      }
    }
  }
}
