{
  "schemaVersion": 1,
  "pipelineVersion": "0.4.0",
  "runMode": "depth",
  "startedAt": "2026-05-17T09:00:00Z",
  "currentPhase": 5,
  "currentSubStage": "pass-2",
  "status": "in-progress",
  "phases": [
    {
      "id": 1, "name": "Scaffold",
      "startedAt": "2026-05-17T09:00:00Z", "finishedAt": "2026-05-17T09:10:00Z",
      "status": "completed",
      "handoverEnvelope": { "role": "phase1-scaffold", "status": "complete" },
      "reviewerVerdict": "approved", "reviewerCycles": 1, "reviewerFindings": [],
      "deliverables": ["playwright.config.ts", "tests/e2e/playwright.setup.ts"]
    },
    {
      "id": 2, "name": "Groundwork",
      "startedAt": "2026-05-17T09:10:00Z", "finishedAt": "2026-05-17T09:40:00Z",
      "status": "completed",
      "handoverEnvelope": { "role": "phase2-groundwork", "status": "complete" },
      "reviewerVerdict": "approved", "reviewerCycles": 1, "reviewerFindings": [],
      "deliverables": ["tests/e2e/docs/app-context.md", "tests/e2e/page-repository.json", "tests/e2e/fixtures/auth.ts"]
    },
    {
      "id": 3, "name": "Happy-path",
      "startedAt": "2026-05-17T09:40:00Z", "finishedAt": "2026-05-17T10:30:00Z",
      "status": "completed",
      "handoverEnvelope": { "role": "composer-happy-path", "status": "new-tests-landed" },
      "reviewerVerdict": "approved", "reviewerCycles": 2,
      "reviewerFindings": [
        { "checklist-item": "discovery-draft seeded", "what-missing": "missing on first reviewer pass", "methodology-ref": "skills/onboarding/SKILL.md §Phase 3", "fix-instruction": "have composer emit .discovery-draft.json before declaring done" }
      ],
      "deliverables": ["tests/e2e/sign-in.spec.ts", "tests/e2e/checkout.spec.ts", "tests/e2e/docs/.discovery-draft.json"]
    },
    {
      "id": 4, "name": "Journey-mapping",
      "startedAt": "2026-05-17T10:30:00Z", "finishedAt": "2026-05-17T12:00:00Z",
      "status": "completed",
      "handoverEnvelope": { "role": "phase4-prioritise-author", "status": "journey-map-authored" },
      "reviewerVerdict": "approved", "reviewerCycles": 1, "reviewerFindings": [],
      "deliverables": ["tests/e2e/docs/journey-map.md", "tests/e2e/docs/journey-map-coverage.md"],
      "subStages": [
        { "id": "cycle-1", "status": "completed", "reviewerVerdict": "approved", "reviewerCycles": 1 },
        { "id": "cycle-2", "status": "completed", "reviewerVerdict": "approved", "reviewerCycles": 1 }
      ]
    },
    {
      "id": 5, "name": "Coverage-expansion",
      "startedAt": "2026-05-17T12:00:00Z", "finishedAt": null,
      "status": "in-progress",
      "handoverEnvelope": null,
      "reviewerVerdict": "pending", "reviewerCycles": 0, "reviewerFindings": [],
      "deliverables": ["tests/e2e/cart.spec.ts", "tests/e2e/profile.spec.ts"],
      "subStages": [
        { "id": "pass-1", "status": "completed", "reviewerVerdict": "approved", "reviewerCycles": 1 },
        { "id": "pass-2", "status": "in-progress", "reviewerVerdict": "pending", "reviewerCycles": 0 }
      ]
    },
    { "id": 6, "name": "Bug-discovery",  "status": "pending", "reviewerVerdict": "pending", "reviewerCycles": 0, "deliverables": [] },
    { "id": 7, "name": "Secrets-sweep",  "status": "pending", "reviewerVerdict": "pending", "reviewerCycles": 0, "deliverables": [] },
    { "id": 8, "name": "Report",         "status": "pending", "reviewerVerdict": "pending", "reviewerCycles": 0, "deliverables": [] }
  ],
  "approvedDeviations": []
}
